{
  "schemaVersion": 1,
  "id": "D-coord-012",
  "lane": "coord",
  "title": "Strategy model: ordered steps with submodalities; anchors are step detail; triad is derived",
  "status": "accepted",
  "type": "product",
  "context": "The playbook elicits a strategy as an ordered sequence of represented steps (for example see something, say something to myself, feel it), where the order matters as much as the parts, and then the submodalities of each step. The product owner noted it maps onto Peak State's extraction session: the strategies are the sequence and the song, scene and body anchors are the submodality detail. Current lane plans assume fixed physiology, focus and language slots run in that order (D-contracts-003, D-reps-002).",
  "decision": "A state's strategy is an ordered list of steps. Each step has a modality (visual, auditory or kinesthetic, plus other senses if offered), a direction (external or internal), the content in the person's words, and the submodalities from the playbook's core list (extended list optional). Song, scene and body anchors are stored as submodality detail on the matching step, and one step is marked as the anchor step. The contrast state's submodalities, the differences, and the drivers (the 1 to 3 differences with the largest rating change in the one-at-a-time test) are stored with the state as hypotheses with their measured deltas. The physiology, focus and language triad is a derived view (feeling steps to physiology, picture steps to focus, self-talk steps to language), never stored separately. Reps replay the person's own step order and speak the driver submodalities.",
  "alternatives": [
    "Keep fixed triad slots and squeeze the sequence into them: loses the order, which the method says matters",
    "Store free text only: reps and detection cannot use it"
  ],
  "consequences": "contracts redefines Profile v2 and the RepSession steps; reps supersedes D-reps-002's fixed order; sensing gets peak and contrast calibration windows from the playbook itself.",
  "produces": [
    "docs/hackathon/elicitation-playbook.md"
  ],
  "dependsOn": [
    "D-coord-011"
  ],
  "supersedes": [],
  "author": "product owner (via coord)",
  "session": {
    "id": "session_01QVbLwShgFGPq3zbXjnSGBK",
    "url": "https://claude.ai/code/session_01QVbLwShgFGPq3zbXjnSGBK",
    "branch": "claude/awesome-wright-ciik1f"
  },
  "createdAt": "2026-10-03T14:33:07Z",
  "acceptedAt": "2026-10-03T14:33:07Z",
  "acceptedBy": "product owner (via coord)"
}
